{
  "schema_id": "obliteratus.checkpoint-descriptor",
  "schema_version": "1.0.0",
  "descriptor_id": "fixture-typed-offset-namespaces",
  "primary_format": "megatron_torch_dist",
  "classification_confidence": "verified",
  "components": [
    {
      "component_id": "model",
      "kind": "model",
      "format": "megatron_torch_dist",
      "producer": {
        "name": "megatron-core",
        "version": "fixture-version",
        "format_version": "torch_dist",
        "evidence_refs": ["ev-producer"]
      },
      "state_scopes": ["model_weights"],
      "topology_ref": "saved-topology",
      "inventory_refs": ["shard-0"],
      "tensor_fragment_refs": ["fragment-0"]
    }
  ],
  "producer": {
    "name": "megatron-core",
    "version": "fixture-version",
    "format_version": "torch_dist",
    "evidence_refs": ["ev-producer"]
  },
  "evidence": [
    {
      "evidence_id": "ev-producer",
      "subject": "/producer",
      "kind": "explicit_metadata",
      "file_ref": "shard-0",
      "location": "fixture metadata producer",
      "confidence": "verified",
      "verifier": "neutral-fixture-generator-v1"
    }
  ],
  "source_inventory": {
    "inventory_id": "inventory-0",
    "files": [
      {
        "file_id": "shard-0",
        "relative_path": "rank-0/model.safetensors",
        "role": "model_fragment",
        "size_bytes": 16,
        "sha256": "sha256:0000000000000000000000000000000000000000000000000000000000000000",
        "regular_file": true,
        "observation_id": "dev-1:ino-1:size-16:mtime-0"
      }
    ],
    "total_bytes": 16,
    "observation_complete": true
  },
  "safety": {
    "inspection_level": "trusted_metadata",
    "trust_required": true,
    "inventory_revalidated": true,
    "unsafe_serialization_findings": [],
    "violations": []
  },
  "state": {
    "observed_scopes": ["model_weights"],
    "classification": "weights_only"
  },
  "topologies": [
    {
      "topology_id": "saved-topology",
      "kind": "saved",
      "node_count": {"value": 1, "provenance": "explicit", "evidence_refs": ["ev-producer"]},
      "global_world_size": {"value": 1, "provenance": "explicit", "evidence_refs": ["ev-producer"]},
      "machine_rank": {"value": 0, "provenance": "explicit", "evidence_refs": ["ev-producer"]},
      "global_rank": {"value": 0, "provenance": "explicit", "evidence_refs": ["ev-producer"]},
      "local_rank": {"value": 0, "provenance": "explicit", "evidence_refs": ["ev-producer"]},
      "tp_size": {"value": 1, "provenance": "explicit", "evidence_refs": ["ev-producer"]},
      "pp_size": {"value": 1, "provenance": "explicit", "evidence_refs": ["ev-producer"]},
      "dp_size": {"value": 1, "provenance": "explicit", "evidence_refs": ["ev-producer"]},
      "cp_size": {"value": 1, "provenance": "explicit", "evidence_refs": ["ev-producer"]},
      "ep_size": {"value": 1, "provenance": "explicit", "evidence_refs": ["ev-producer"]},
      "etp_size": {"value": null, "provenance": "unknown", "evidence_refs": []},
      "zero_stage": {"value": null, "provenance": "unknown", "evidence_refs": []}
    }
  ],
  "tensor_fragments": [
    {
      "fragment_id": "fragment-0",
      "component_id": "model",
      "fqn": "layer.weight",
      "role": "parameter",
      "dtype": "F32",
      "global_shape": [2, 2],
      "local_shape": [2, 2],
      "element_offset": [0, 0],
      "element_extent": [2, 2],
      "padding": {"before": [0, 0], "after": [0, 0], "semantic": "none"},
      "shard_file_id": "shard-0",
      "shard_digest_ref": "shard-0",
      "fragment_digest": null,
      "replica": {"group_id": null, "member_index": 0, "member_count": 1},
      "partition_axes": [],
      "logical_tensor_id": "layer.weight",
      "tie_group_id": null,
      "shared_storage_id": null,
      "storage_locations": [
        {"kind": "logical_element_range", "element_offset": [0, 0], "element_extent": [2, 2]},
        {"kind": "megatron_rank_offsets", "global_offset": [0, 0], "rank_offsets": [[0, 0, 1]]},
        {"kind": "safetensors_byte_range", "begin": 0, "end": 16},
        {"kind": "hf_weight_map", "tensor_name": "layer.weight", "file_id": "shard-0"}
      ],
      "evidence_refs": ["ev-producer"]
    }
  ],
  "adapter_resolution": {
    "status": "matched",
    "adapter_id": "fixture-megatron",
    "adapter_version": "0.0.0-fixture",
    "capability_digest": "sha256:1111111111111111111111111111111111111111111111111111111111111111",
    "reason": "Neutral schema fixture only; not a product support claim."
  },
  "conversion_plan": {
    "eligible": true,
    "target_format": "hf_safetensors",
    "state_scope": "weights_only",
    "dropped_scopes": []
  },
  "resource_estimate": {
    "source_bytes": 16,
    "logical_bytes": 16,
    "output_bytes": 16,
    "temporary_bytes": 32,
    "peak_ram_bytes": 16,
    "peak_vram_bytes": 0,
    "file_count": 1,
    "tensor_count": 1,
    "shard_count": 1,
    "assumptions": ["neutral fixture"],
    "confidence": "verified",
    "admission": "admitted"
  },
  "support_decision": "conversion_supported",
  "blockers": []
}
